A2: Day | B2: Time | D2: Latº | E2: Lat' | F2: Lonº | G2: Lon' | H2: SOG (KTS) | I2: COG(ºT) | J2: Mb | K2: TWD(ºT) | L2: TWS (KTS) | M2: TWS (M/S) | N2: AT(ºC) | O2: ST(ºC) | P2: Cloud Coverage
A3: 1 | B3: 20040419 | C3: 1300Z | D3: -23 | E3: 28 | F3: -42 | G3: 45 | H3: 2 | I3: 180 | J3: 1010 | K3: 90 | L3: 10 | M3: =L3*0.5144 -> 5.1440000000000001 | N3: 31 | O3: 26 | P3: 0
A4: 2 | B4: 20040420 | C4: 1200Z | D4: -24 | E4: 0 | F4: -42 | G4: 12 | H4: 0 | I4: 0 | J4: 1015 | K4: 225 | L4: 0 | M4: 0 | N4: 29 | O4: 26 | P4: 0.1
A5: 3 | B5: 20040421 | C5: 1300Z | D5: -23 | E5: 55 | F5: -41 | G5: 30 | H5: 3 | I5: 90 | J5: 1019 | K5: 180 | L5: 10 | M5: =L5*0.5144 -> 5.1440000000000001 | N5: 27 | O5: 26 | P5: 0.25
A6: 4 | B6: 20040422 | C6: 1300Z | D6: -24 | E6: 49 | F6: -41 | G6: 32 | H6: 3 | I6: 180 | J6: 1020 | K6: 110 | L6: 10 | M6: =L6*0.5144 -> 5.1440000000000001 | N6: 30 | O6: 26 | P6: 0.7
A7: 5 | B7: 20040423 | C7: 1300Z | D7: -25 | E7: 33 | F7: -40 | G7: 29 | H7: 3.5 | I7: 130 | J7: 1015 | K7: 30 | L7: 20 | M7: =L7*0.5144 -> 10.288 | N7: 31 | O7: 25 | P7: 0.05
A8: 6 | B8: 20040424 | C8: 1300Z | D8: -26 | E8: 2 | F8: -39 | G8: 20 | H8: 4 | I8: 130 | J8: 1011 | K8: 335 | L8: 15 | M8: =L8*0.5144 -> 7.7159999999999993 | N8: 29 | O8: 24.5 | P8: 0.1
A9: 7 | B9: 20040425 | C9: 1300Z | D9: -26 | E9: 35 | F9: -38 | G9: 29 | H9: 3.5 | I9: 95 | J9: 1013 | K9: 135 | L9: 20 | M9: =L9*0.5144 -> 10.288 | N9: 27 | O9: 24 | P9: 0.3
A10: 8 | B10: 20040426 | C10: 1300Z | D10: -26 | E10: 47 | F10: -37 | G10: 37 | H10: 0 | I10: 90 | J10: 1017 | K10: 135 | L10: 0 | M10: =L10*0.5144 -> 0 | N10: 25 | O10: 23.5 | P10: 0.3
A11: 9 | B11: 20040427 | C11: 1300Z | D11: -26 | E11: 35 | F11: -36 | G11: 58 | H11: 0 | I11: 0 | J11: 1019 | K11: 0 | L11: 0 | M11: =L11*0.5144 -> 0 | N11: 22 | O11: 23.5 | P11: 0.9
A12: 10 | B12: 20040428 | C12: 1300Z | D12: -27 | E12: 14 | F12: -37 | G12: 15 | H12: 2.5 | I12: 195 | J12: 1023 | K12: 135 | L12: 8 | M12: =L12*0.5144 -> 4.1151999999999997 | N12: 24 | O12: 24 | P12: 0.1
A13: 11 | B13: 20040429 | C13: 1130Z | D13: -28 | E13: 9 | F13: -37 | G13: 52 | H13: 2.5 | I13: 195 | J13: 1022 | K13: 135 | L13: 12 | M13: =L13*0.5144 -> 6.1727999999999996 | N13: 23 | O13: 23.5 | P13: 0.75
A14: 12 | B14: 20040430 | C14: 1130Z | D14: -29 | E14: 10 | F14: -37 | G14: 55 | H14: 3.5 | I14: 155 | J14: 1019 | K14: 90 | L14: 15 | M14: =L14*0.5144 -> 7.7159999999999993 | N14: 23 | O14: 22.5 | P14: 0
A15: 13 | B15: 20040501 | C15: 1130Z | D15: -29 | E15: 35 | F15: -37 | G15: 31 | H15: 0 | I15: 0 | J15: 1016 | K15: 0 | L15: 0 | M15: =L15*0.5144 -> 0 | N15: 24 | O15: 22.5 | P15: 0
A16: 14 | B16: 20040502 | C16: 1130Z | D16: -30 | E16: 14 | F16: -37 | G16: 16 | H16: 3.5 | I16: 155 | J16: 1015 | K16: 270 | L16: 10 | M16: =L16*0.5144 -> 5.1440000000000001 | N16: 23 | O16: 22 | P16: 1
A17: 15 | B17: 20040503 | C17: 1130Z | D17: -30 | E17: 55 | F17: -36 | G17: 56 | H17: 0 | I17: 0 | J17: 1018 | K17: 0 | L17: 0 | M17: =L17*0.5144 -> 0 | N17: 24 | O17: 22 | P17: 0
A18: 16 | B18: 20040504 | C18: 1130Z | D18: -31 | E18: 14 | F18: -35 | G18: 43 | H18: 4 | I18: 80 | J18: 1020 | K18: 135 | L18: 30 | M18: =L18*0.5144 -> 15.431999999999999 | N18: 19 | O18: 21 | P18: 1
A19: 17 | B19: 20040505 | C19: 1130Z | D19: -32 | E19: 5 | F19: -35 | G19: 39 | H19: 4 | I19: 190 | J19: 1022 | K19: 135 | L19: 30 | M19: =L19*0.5144 -> 15.431999999999999 | N19: 18 | O19: 19.2 | P19: 0.95
A20: 18 | B20: 20040506 | C20: 1130Z | D20: -33 | E20: 23 | F20: -35 | G20: 58 | H20: 4 | I20: 190 | J20: 1025 | K20: 135 | L20: 20 | M20: =L20*0.5144 -> 10.288 | N20: 20 | O20: 17.5 | P20: 0.95
A21: 19 | B21: 20040507 | C21: 1130Z | D21: -34 | E21: 29 | F21: -35 | G21: 56 | H21: 3 | I21: 180 | J21: 1020 | K21: 120 | L21: 10 | M21: =L21*0.5144 -> 5.1440000000000001 | N21: 19 | O21: 16.5 | P21: 0.8
A22: 20 | B22: 20040508 | C22: 1130Z | D22: -35 | E22: 21 | F22: -35 | G22: 38 | H22: 0 | I22: 0 | J22: 1015 | K22: 0 | L22: 0 | M22: =L22*0.5144 -> 0 | N22: 19 | O22: 16.3 | P22: 0.5
A23: 21 | B23: 20040509 | C23: 1000Z | D23: -36 | E23: 15 | F23: -35 | G23: 26 | H23: 0 | I23: 0 | J23: 1011 | K23: 0 | L23: 0 | M23: =L23*0.5144 -> 0 | N23: 18 | O23: 16 | P23: 0.5
A24: 22 | B24: 20040510 | C24: 1130Z | D24: -36 | E24: 38 | F24: -34 | G24: 58 | H24: 0 | I24: 0 | J24: 1012 | K24: 0 | L24: 0 | M24: =L24*0.5144 -> 0 | N24: 17 | O24: 15.5 | P24: 0.5
A25: 23 | B25: 20040511 | C25: 1130Z | D25: -37 | E25: 29 | F25: -34 | G25: 35 | H25: 0 | I25: 0 | J25: 1012 | K25: 0 | L25: 0 | M25: =L25*0.5144 -> 0 | N25: 18 | O25: 15 | P25: 0.4
A26: 24 | B26: 20040512 | C26: 1130Z | D26: -37 | E26: 30 | F26: -33 | G26: 55 | H26: 0 | I26: 0 | J26: 1017 | K26: 0 | L26: 0 | M26: =L26*0.5144 -> 0 | N26: 18 | O26: 15 | P26: 0.7
A27: 25 | B27: 20040513 | C27: 1130Z | D27: -37 | E27: 50 | F27: -33 | G27: 15 | H27: 3 | I27: 140 | J27: 1012 | K27: 35 | L27: 10 | M27: =L27*0.5144 -> 5.1440000000000001 | N27: 16 | O27: 14.5 | P27: 1
A28: 26 | B28: 20040514 | C28: 1130Z | D28: -38 | E28: 35 | F28: -32 | G28: 12 | H28: 5 | I28: 110 | J28: 1009 | K28: 235 | L28: 25 | M28: =L28*0.5144 -> 12.86 | N28: 13 | O28: 13.8 | P28: 0.3
A29: 27 | B29: 20040515 | C29: 1130Z | D29: -39 | E29: 5 | F29: -31 | G29: 15 | H29: 0 | I29: 0 | J29: 1012 | K29: 0 | L29: 0 | M29: =L29*0.5144 -> 0 | N29: 14 | O29: 13 | P29: 1
A30: 28 | B30: 20040516 | C30: 1130Z | D30: -39 | E30: 43 | F30: -30 | G30: 45 | H30: 2.5 | I30: 175 | J30: 997 | K30: 90 | L30: 5 | M30: =L30*0.5144 -> 2.5720000000000001 | N30: 14 | O30: 13 | P30: 1
A31: 29 | B31: 20040517 | C31: 1130Z | D31: -39 | E31: 57 | F31: -28 | G31: 57 | H31: 0 | I31: 0 | J31: 1000 | K31: 0 | L31: 0 | M31: =L31*0.5144 -> 0 | N31: 14 | O31: 13.2 | P31: 0
A32: 30 | B32: 20040518 | C32: 1000Z | D32: -40 | E32: 13 | F32: -29 | G32: 5 | H32: 5 | I32: 90 | J32: 989 | K32: 300 | L32: 50 | M32: =L32*0.5144 -> 25.72 | N32: 10 | O32: 12 | P32: 1
A33: 31 | B33: 20040519 | C33: 1030Z | D33: -39 | E33: 32 | F33: -27 | G33: 35 | H33: 5 | I33: 85 | J33: 1004 | K33: 330 | L33: 40 | M33: =L33*0.5144 -> 20.576000000000001 | N33: 11 | O33: 12 | P33: 0.7
A34: 32 | B34: 20040520 | C34: 1130Z | D34: -38 | E34: 39 | F34: -25 | G34: 53 | H34: 6 | I34: 75 | J34: 1005 | K34: 300 | L34: 45 | M34: =L34*0.5144 -> 23.148 | N34: 13 | O34: 12 | P34: 0.85
A35: 33 | B35: 20040521 | C35: 1130Z | D35: -37 | E35: 47 | F35: -24 | G35: 10 | H35: 5 | I35: 90 | J35: 1005 | K35: 270 | L35: 35 | M35: =L35*0.5144 -> 18.003999999999998 | N35: 12 | O35: 12 | P35: 1
A36: 34 | B36: 20040522 | C36: 1130Z | D36: -37 | E36: 5 | F36: -23 | G36: 0 | H36: 4.5 | I36: 90 | J36: 1011 | K36: 235 | L36: 20 | M36: =L36*0.5144 -> 10.288 | N36: 13 | O36: 12.5 | P36: 0.75
A37: 35 | B37: 20040523 | C37: 1130Z | D37: -37 | E37: 0 | F37: -22 | G37: 0 | H37: 0 | I37: 0 | J37: 1016 | K37: 0 | L37: 0 | M37: =L37*0.5144 -> 0 | N37: 15 | O37: 12 | P37: 0.3
A38: 36 | B38: 20040524 | C38: 1130Z | D38: -37 | E38: 0 | F38: -20 | G38: 50 | H38: 3 | I38: 90 | J38: 1010 | K38: 270 | L38: 15 | M38: =L38*0.5144 -> 7.7159999999999993 | N38: 15 | O38: 12.5 | P38: 0.3
A39: 37 | B39: 20040525 | C39: 1130Z | D39: -37 | E39: 21 | F39: -19 | G39: 30 | H39: 4 | I39: 90 | J39: 998 | K39: 235 | L39: 55 | M39: =L39*0.5144 -> 28.291999999999998 | N39: 13 | O39: 11.5 | P39: 1
A40: 38 | B40: 20040526 | C40: 1130Z | D40: -37 | E40: 40 | F40: -18 | G40: 9 | H40: 4 | I40: 90 | J40: 1010 | K40: 250 | L40: 15 | M40: =L40*0.5144 -> 7.7159999999999993 | N40: 14 | O40: 12 | P40: 0.3
A41: 39 | B41: 20040527 | C41: 1130Z | D41: -37 | E41: 48 | F41: -16 | G41: 20 | H41: 4 | I41: 80 | J41: 1010 | K41: 350 | L41: 30 | M41: =L41*0.5144 -> 15.431999999999999 | N41: 14 | O41: 12.5 | P41: 0.9
A42: 40 | B42: 20040528 | C42: 0530Z | D42: -38 | E42: 4 | F42: -15 | G42: 10 | H42: 6 | I42: 90 | J42: 975 | K42: 340 | L42: 60 | M42: =L42*0.5144 -> 30.863999999999997 | N42: 11 | O42: 8.5 | P42: 1
A43: 41 | B43: 20040529 | C43: 1130Z | D43: -37 | E43: 56 | F43: -14 | G43: 45 | H43: 3 | I43: 90 | J43: 1011 | K43: 270 | L43: 20 | M43: =L43*0.5144 -> 10.288 | N43: 12 | O43: 12 | P43: 0.75
A44: 42 | B44: 20040530 | C44: 1130Z | D44: -37 | E44: 42 | F44: -13 | G44: 32 | H44: 4 | I44: 70 | J44: 1024 | K44: 270 | L44: 10 | M44: =L44*0.5144 -> 5.1440000000000001 | N44: 16 | O44: 12 | P44: 0
A45: 43 | B45: 20040531 | C45: 1600Z | D45: -37 | E45: 3.6819999999999999 | F45: -12 | G45: 18.422999999999998 | H45: 0 | I45: 0 | J45: 1012 | K45: 0 | L45: 0 | M45: =L45*0.5144 -> 0 | N45: 15 | O45: 12 | P45: 0
A46: 44 | B46: 20040601 | C46: 2300Z | D46: -36 | E46: 53 | F46: -11 | G46: 45 | H46: 5 | I46: 65 | J46: 994 | K46: 270 | L46: 55 | M46: =L46*0.5144 -> 28.291999999999998 | N46: 8 | O46: 12 | P46: 1
A47: 45 | B47: 20040602 | C47: 1130Z | D47: -36 | E47: 54 | F47: -11 | G47: 2 | H47: 90 | I47: 4 | J47: 1008 | K47: 330 | L47: 35 | M47: =L47*0.5144 -> 18.003999999999998 | N47: 14 | O47: 11 | P47: 0.7
A48: 46 | B48: 20040603 | C48: 1130Z | D48: -36 | E48: 52 | F48: -9 | G48: 55 | H48: 90 | I48: 4 | J48: 1006 | K48: 340 | L48: 30 | M48: =L48*0.5144 -> 15.431999999999999 | N48: 15 | O48: 12 | P48: 0.4
A49: 47 | B49: 20040604 | C49: 1130Z | D49: -36 | E49: 32 | F49: -8 | G49: 40 | H49: 85 | I49: 4 | J49: 1015 | K49: 225 | L49: 35 | M49: =L49*0.5144 -> 18.003999999999998 | N49: 11 | O49: 10.5 | P49: 0.15
A50: 48 | B50: 20040605 | C50: 1130Z | D50: -36 | E50: 25 | F50: -7 | G50: 15 | H50: 75 | I50: 3.5 | J50: 1018 | K50: 225 | L50: 25 | M50: =L50*0.5144 -> 12.86 | N50: 12 | O50: 11.4 | P50: 0.5
A51: 49 | B51: 20040606 | C51: 1130Z | D51: -36 | E51: 25 | F51: -5 | G51: 55 | H51: 99 | I51: 3 | J51: 1024 | K51: 225 | L51: 10 | M51: =L51*0.5144 -> 5.1440000000000001 | N51: 11 | O51: 9.3 | P51: 1
A52: 50 | B52: 20040607 | C52: 1130Z | D52: -36 | E52: 43 | F52: -5 | G52: 0 | H52: 170 | I52: 2 | J52: 1024 | K52: 270 | L52: 5 | M52: =L52*0.5144 -> 2.5720000000000001 | N52: 13 | O52: 10.2 | P52: 1
A53: 51 | B53: 20040608 | C53: 1130Z | D53: -37 | E53: 12 | F53: -3 | G53: 55 | H53: 120 | I53: 4 | J53: 1008 | K53: 335 | L53: 35 | M53: =L53*0.5144 -> 18.003999999999998 | N53: 14 | O53: 11 | P53: 0
A54: 52 | B54: 20040609 | C54: 1130Z | D54: -37 | E54: 12 | F54: -2 | G54: 50 | H54: 90 | I54: 2 | J54: 1019 | K54: 170 | L54: 10 | M54: =L54*0.5144 -> 5.1440000000000001 | N54: 13 | O54: 9.4 | P54: 0.2
A55: 53 | B55: 20040610 | C55: 1130Z | D55: -37 | E55: 4 | F55: -2 | G55: 20 | H55: 0 | I55: 0 | J55: 1024 | K55: 0 | L55: 0 | M55: =L55*0.5144 -> 0 | N55: 14 | O55: 11 | P55: 1
A56: 54 | B56: 20040611 | C56: 1130Z | D56: -37 | E56: 7 | F56: -1 | G56: 4 | H56: 90 | I56: 4.5 | J56: 1015 | K56: 340 | L56: 35 | M56: =L56*0.5144 -> 18.003999999999998 | N56: 14 | O56: 11 | P56: 1
A57: 55 | B57: 20040612 | C57: 0730Z | D57: -37 | E57: 18 | F57: 0 | G57: 0 | H57: 90 | I57: 6 | J57: 1009 | K57: 340 | L57: 45 | M57: =L57*0.5144 -> 23.148 | N57: 8 | O57: 9.2 | P57: 1
A58: 56 | B58: 20040613 | C58: 1130Z | D58: -37 | E58: 31 | F58: 1 | G58: 48 | H58: 100 | I58: 3.5 | J58: 1010 | K58: 200 | L58: 20 | M58: =L58*0.5144 -> 10.288 | N58: 13 | O58: 9.1 | P58: 1
A59: 57 | B59: 20040614 | C59: 1900Z | D59: -37 | E59: 23 | F59: 3 | G59: 7 | H59: 80 | I59: 4 | J59: 1006 | K59: 330 | L59: 40 | M59: =L59*0.5144 -> 20.576000000000001 | N59: 14 | O59: 9.5 | P59: 0.9
A60: 58 | B60: 20040615 | C60: 1130Z | D60: -36 | E60: 56 | F60: 4 | G60: 11 | H60: 90 | I60: 2 | J60: 1025 | K60: 200 | L60: 15 | M60: =L60*0.5144 -> 7.7159999999999993 | N60: 14 | O60: 9.6 | P60: 1
A61: 59 | B61: 20040616 | C61: 1130Z | D61: -36 | E61: 59 | F61: 4 | G61: 44 | H61: 95 | I61: 2 | J61: 1016 | K61: 300 | L61: 10 | M61: =L61*0.5144 -> 5.1440000000000001 | N61: 14 | O61: 8.3 | P61: 0.9
A62: 60 | B62: 20040617 | C62: 1130Z | D62: -37 | E62: 12 | F62: 5 | G62: 55 | H62: 90 | I62: 2.5 | J62: 1015 | K62: 330 | L62: 15 | M62: =L62*0.5144 -> 7.7159999999999993 | N62: 14 | O62: 10 | P62: 1
A63: 61 | B63: 20040618 | C63: 1130Z | D63: -37 | E63: 15 | F63: 7 | G63: 15 | H63: 90 | I63: 3.5 | J63: 1011 | K63: 330 | L63: 45 | M63: =L63*0.5144 -> 23.148 | N63: 15 | O63: 10.5 | P63: 1
A64: 62 | B64: 20040619 | C64: 1130Z | D64: -37 | E64: 6 | F64: 8 | G64: 45 | H64: 0 | I64: 0 | J64: 1025 | K64: 0 | L64: 0 | M64: =L64*0.5144 -> 0 | N64: 12 | O64: 11 | P64: 0
A65: 63 | B65: 20040620 | C65: 1130Z | D65: -37 | E65: 10 | F65: 9 | G65: 50 | H65: 95 | I65: 3 | J65: 1021 | K65: 300 | L65: 25 | M65: =L65*0.5144 -> 12.86 | N65: 11 | O65: 11.5 | P65: 0.95
A66: 64 | B66: 20040621 | C66: 1130Z | D66: -37 | E66: 10 | F66: 10 | G66: 45 | H66: 95 | I66: 2 | J66: 1016 | K66: 330 | L66: 35 | M66: =L66*0.5144 -> 18.003999999999998 | N66: 14 | O66: 11 | P66: 1
A67: 65 | B67: 20040622 | C67: 1130Z | D67: -37 | E67: 33 | F67: 12 | G67: 15 | H67: 100 | I67: 4.5 | J67: 1001 | K67: 0 | L67: 45 | M67: =L67*0.5144 -> 23.148 | N67: 12 | O67: 9.3 | P67: 1
A68: 66 | B68: 20040623 | C68: 1130Z | D68: -36 | E68: 25 | F68: 13 | G68: 45 | H68: 70 | I68: 4 | J68: 1017 | K68: 330 | L68: 40 | M68: =L68*0.5144 -> 20.576000000000001 | N68: 12 | O68: 11.2 | P68: 1
A69: 67 | B69: 20040624 | C69: 1130Z | D69: -36 | E69: 6 | F69: 15 | G69: 49 | H69: 70 | I69: 4 | J69: 1015 | K69: 330 | L69: 45 | M69: =L69*0.5144 -> 23.148 | N69: 13 | O69: 12 | P69: 1
A70: 68 | B70: 20040625 | C70: 1130Z | D70: -35 | E70: 37 | F70: 17 | G70: 27 | H70: 70 | I70: 4 | J70: 1007 | K70: 330 | L70: 50 | M70: =L70*0.5144 -> 25.72 | N70: 15 | O70: 14 | P70: 1
A71: 69 | B71: 20040626 | C71: 1130Z | D71: -34 | E71: 50 | F71: 18 | G71: 31 | H71: 20 | I71: 4 | J71: 1015 | K71: 230 | L71: 25 | M71: =L71*0.5144 -> 12.86 | N71: 17 | O71: 14.5 | P71: 1